{
  "version": 3,
  "license": "CC-BY-4.0",
  "provider": "didww",
  "numbers": [
    {
      "country_code": "AE",
      "number_type": "toll_free",
      "display_name": "United Arab Emirates toll-free",
      "dial_code": "971",
      "usd_per_month": "64.00",
      "voice": true,
      "sms": false,
      "mms": false,
      "verification_required": true,
      "available": true,
      "setup_usd": "64.00",
      "receive_only": true,
      "last_verified": "2026-10-19",
      "last_changed_at": "2026-10-07",
      "verification_method": "carrier-sync",
      "verified_by": "didww-api-sync",
      "source_url": "https://doc.didww.com/api3/2026-04-16/coverage-resources/did-group/get-did-groups.html"
    },
    {
      "country_code": "AG",
      "number_type": "national",
      "display_name": "Antigua and Barbuda national",
      "dial_code": "1",
      "usd_per_month": "33.00",
      "voice": true,
      "sms": false,
      "mms": false,
      "verification_required": true,
      "available": true,
      "receive_only": true,
      "last_verified": "2026-10-19",
      "last_changed_at": "2026-10-07",
      "verification_method": "carrier-sync",
      "verified_by": "didww-api-sync",
      "source_url": "https://doc.didww.com/api3/2026-04-16/coverage-resources/did-group/get-did-groups.html"
    },
    {
      "country_code": "AI",
      "number_type": "national",
      "display_name": "Anguilla national",
      "dial_code": "1",
      "usd_per_month": "33.00",
      "voice": true,
      "sms": false,
      "mms": false,
      "verification_required": true,
      "available": true,
      "receive_only": true,
      "last_verified": "2026-10-19",
      "last_changed_at": "2026-10-07",
      "verification_method": "carrier-sync",
      "verified_by": "didww-api-sync",
      "source_url": "https://doc.didww.com/api3/2026-04-16/coverage-resources/did-group/get-did-groups.html"
    },
    {
      "country_code": "AL",
      "number_type": "local",
      "display_name": "Albania local",
      "dial_code": "355",
      "usd_per_month": "24.00",
      "voice": true,
      "sms": false,
      "mms": false,
      "verification_required": true,
      "available": true,
      "by_request": true,
      "last_verified": "2026-10-19",
      "last_changed_at": "2026-10-07",
      "verification_method": "carrier-sync",
      "verified_by": "didww-api-sync",
      "source_url": "https://doc.didww.com/api3/2026-04-16/coverage-resources/did-group/get-did-groups.html"
    },
    {
      "country_code": "AR",
      "number_type": "local",
      "display_name": "Argentina local",
      "dial_code": "54",
      "usd_per_month": "3.50",
      "voice": true,
      "sms": false,
      "mms": false,
      "verification_required": false,
      "available": true,
      "last_verified": "2026-10-19",
      "last_changed_at": "2026-09-26",
      "verification_method": "carrier-sync",
      "verified_by": "didww-api-sync",
      "source_url": "https://doc.didww.com/api3/2026-04-16/coverage-resources/did-group/get-did-groups.html"
    },
    {
      "country_code": "AR",
      "number_type": "toll_free",
      "display_name": "Argentina toll-free",
      "dial_code": "54",
      "usd_per_month": "20.00",
      "voice": true,
      "sms": false,
      "mms": false,
      "verification_required": false,
      "available": true,
      "setup_usd": "50.00",
      "receive_only": true,
      "last_verified": "2026-10-19",
      "last_changed_at": "2026-10-07",
      "verification_method": "carrier-sync",
      "verified_by": "didww-api-sync",
      "source_url": "https://doc.didww.com/api3/2026-04-16/coverage-resources/did-group/get-did-groups.html"
    },
    {
      "country_code": "AT",
      "number_type": "local",
      "display_name": "Austria local",
      "dial_code": "43",
      "usd_per_month": "3.50",
      "voice": true,
      "sms": false,
      "mms": false,
      "verification_required": true,
      "available": true,
      "by_request": true,
      "last_verified": "2026-10-19",
      "last_changed_at": "2026-10-07",
      "verification_method": "carrier-sync",
      "verified_by": "didww-api-sync",
      "source_url": "https://doc.didww.com/api3/2026-04-16/coverage-resources/did-group/get-did-groups.html"
    },
    {
      "country_code": "AT",
      "number_type": "national",
      "display_name": "Austria national",
      "dial_code": "43",
      "usd_per_month": "3.50",
      "voice": true,
      "sms": false,
      "mms": false,
      "verification_required": true,
      "available": true,
      "last_verified": "2026-10-19",
      "last_changed_at": "2026-09-26",
      "verification_method": "carrier-sync",
      "verified_by": "didww-api-sync",
      "source_url": "https://doc.didww.com/api3/2026-04-16/coverage-resources/did-group/get-did-groups.html"
    },
    {
      "country_code": "AT",
      "number_type": "toll_free",
      "display_name": "Austria toll-free",
      "dial_code": "43",
      "usd_per_month": "10.00",
      "voice": true,
      "sms": false,
      "mms": false,
      "verification_required": false,
      "available": true,
      "setup_usd": "20.00",
      "receive_only": true,
      "last_verified": "2026-10-19",
      "last_changed_at": "2026-10-07",
      "verification_method": "carrier-sync",
      "verified_by": "didww-api-sync",
      "source_url": "https://doc.didww.com/api3/2026-04-16/coverage-resources/did-group/get-did-groups.html"
    },
    {
      "country_code": "AU",
      "number_type": "local",
      "display_name": "Australia local",
      "dial_code": "61",
      "usd_per_month": "3.50",
      "voice": true,
      "sms": false,
      "mms": false,
      "verification_required": true,
      "available": true,
      "last_verified": "2026-10-19",
      "last_changed_at": "2026-09-26",
      "verification_method": "carrier-sync",
      "verified_by": "didww-api-sync",
      "source_url": "https://doc.didww.com/api3/2026-04-16/coverage-resources/did-group/get-did-groups.html"
    },
    {
      "country_code": "AU",
      "number_type": "mobile",
      "display_name": "Australia mobile",
      "dial_code": "61",
      "usd_per_month": "8.00",
      "voice": true,
      "sms": true,
      "mms": false,
      "verification_required": true,
      "available": true,
      "last_verified": "2026-10-19",
      "last_changed_at": "2026-09-26",
      "verification_method": "carrier-sync",
      "verified_by": "didww-api-sync",
      "source_url": "https://doc.didww.com/api3/2026-04-16/coverage-resources/did-group/get-did-groups.html"
    },
    {
      "country_code": "AU",
      "number_type": "toll_free",
      "display_name": "Australia toll-free",
      "dial_code": "61",
      "usd_per_month": "9.00",
      "voice": true,
      "sms": false,
      "mms": false,
      "verification_required": true,
      "available": true,
      "setup_usd": "65.00",
      "receive_only": true,
      "last_verified": "2026-10-19",
      "last_changed_at": "2026-10-07",
      "verification_method": "carrier-sync",
      "verified_by": "didww-api-sync",
      "source_url": "https://doc.didww.com/api3/2026-04-16/coverage-resources/did-group/get-did-groups.html"
    },
    {
      "country_code": "BA",
      "number_type": "national",
      "display_name": "Bosnia and Herzegovina national",
      "dial_code": "387",
      "usd_per_month": "35.00",
      "voice": true,
      "sms": false,
      "mms": false,
      "verification_required": true,
      "available": true,
      "receive_only": true,
      "last_verified": "2026-10-19",
      "last_changed_at": "2026-10-07",
      "verification_method": "carrier-sync",
      "verified_by": "didww-api-sync",
      "source_url": "https://doc.didww.com/api3/2026-04-16/coverage-resources/did-group/get-did-groups.html"
    },
    {
      "country_code": "BA",
      "number_type": "toll_free",
      "display_name": "Bosnia and Herzegovina toll-free",
      "dial_code": "387",
      "usd_per_month": "48.00",
      "voice": true,
      "sms": false,
      "mms": false,
      "verification_required": true,
      "available": true,
      "setup_usd": "115.00",
      "receive_only": true,
      "last_verified": "2026-10-19",
      "last_changed_at": "2026-10-07",
      "verification_method": "carrier-sync",
      "verified_by": "didww-api-sync",
      "source_url": "https://doc.didww.com/api3/2026-04-16/coverage-resources/did-group/get-did-groups.html"
    },
    {
      "country_code": "BB",
      "number_type": "national",
      "display_name": "Barbados national",
      "dial_code": "1",
      "usd_per_month": "33.00",
      "voice": true,
      "sms": false,
      "mms": false,
      "verification_required": true,
      "available": true,
      "receive_only": true,
      "last_verified": "2026-10-19",
      "last_changed_at": "2026-10-07",
      "verification_method": "carrier-sync",
      "verified_by": "didww-api-sync",
      "source_url": "https://doc.didww.com/api3/2026-04-16/coverage-resources/did-group/get-did-groups.html"
    },
    {
      "country_code": "BE",
      "number_type": "local",
      "display_name": "Belgium local",
      "dial_code": "32",
      "usd_per_month": "2.50",
      "voice": true,
      "sms": false,
      "mms": false,
      "verification_required": true,
      "available": true,
      "by_request": true,
      "last_verified": "2026-10-19",
      "last_changed_at": "2026-10-07",
      "verification_method": "carrier-sync",
      "verified_by": "didww-api-sync",
      "source_url": "https://doc.didww.com/api3/2026-04-16/coverage-resources/did-group/get-did-groups.html"
    },
    {
      "country_code": "BE",
      "number_type": "mobile",
      "display_name": "Belgium mobile",
      "dial_code": "32",
      "usd_per_month": "8.00",
      "voice": true,
      "sms": true,
      "mms": false,
      "verification_required": true,
      "available": true,
      "last_verified": "2026-10-19",
      "last_changed_at": "2026-09-26",